<?xml version="1.0" encoding="UTF-8"?>
<!ELEMENT employees (employee+)>
<!ELEMENT employee (name, gender, phone, email)>
<!ELEMENT name (#PCDATA)>
<!ELEMENT gender (#PCDATA)>
<!ELEMENT phone (#PCDATA)>
<!ELEMENT email (#PCDATA)>
